[{"state_code":"AGU","state_name":"Aguascalientes","year":2020,"organ":"cornea","donations":107,"transplants":16,"waitlist_end_of_year":null,"rate_pmp":11.0,"donor_type_breakdown":{"deceased":11,"living":0}},{"state_code":"AGU","state_name":"Aguascalientes","year":2020,"organ":"kidney","donations":107,"transplants":40,"waitlist_end_of_year":null,"rate_pmp":27.5,"donor_type_breakdown":{"deceased":9,"living":31}},{"state_code":"AGU","state_name":"Aguascalientes","year":2020,"organ":"liver","donations":107,"transplants":1,"waitlist_end_of_year":null,"rate_pmp":0.7,"donor_type_breakdown":{"deceased":1,"living":0}},{"state_code":"AGU","state_name":"Aguascalientes","year":2021,"organ":"cornea","donations":248,"transplants":46,"waitlist_end_of_year":null,"rate_pmp":31.2,"donor_type_breakdown":{"deceased":44,"living":0}},{"state_code":"AGU","state_name":"Aguascalientes","year":2021,"organ":"kidney","donations":248,"transplants":91,"waitlist_end_of_year":null,"rate_pmp":61.8,"donor_type_breakdown":{"deceased":8,"living":83}},{"state_code":"AGU","state_name":"Aguascalientes","year":2021,"organ":"liver","donations":248,"transplants":1,"waitlist_end_of_year":null,"rate_pmp":0.7,"donor_type_breakdown":{"deceased":1,"living":0}},{"state_code":"AGU","state_name":"Aguascalientes","year":2022,"organ":"cornea","donations":293,"transplants":41,"waitlist_end_of_year":null,"rate_pmp":27.5,"donor_type_breakdown":{"deceased":41,"living":0}},{"state_code":"AGU","state_name":"Aguascalientes","year":2022,"organ":"kidney","donations":293,"transplants":95,"waitlist_end_of_year":null,"rate_pmp":63.7,"donor_type_breakdown":{"deceased":2,"living":93}},{"state_code":"AGU","state_name":"Aguascalientes","year":2022,"organ":"liver","donations":293,"transplants":1,"waitlist_end_of_year":null,"rate_pmp":0.7,"donor_type_breakdown":{"deceased":0,"living":1}},{"state_code":"AGU","state_name":"Aguascalientes","year":2023,"organ":"cornea","donations":369,"transplants":46,"waitlist_end_of_year":null,"rate_pmp":30.4,"donor_type_breakdown":{"deceased":43,"living":0}},{"state_code":"AGU","state_name":"Aguascalientes","year":2023,"organ":"kidney","donations":369,"transplants":134,"waitlist_end_of_year":null,"rate_pmp":88.7,"donor_type_breakdown":{"deceased":31,"living":103}},{"state_code":"AGU","state_name":"Aguascalientes","year":2024,"organ":"cornea","donations":415,"transplants":44,"waitlist_end_of_year":null,"rate_pmp":28.8,"donor_type_breakdown":{"deceased":43,"living":0}},{"state_code":"AGU","state_name":"Aguascalientes","year":2024,"organ":"heart","donations":415,"transplants":1,"waitlist_end_of_year":null,"rate_pmp":0.7,"donor_type_breakdown":{"deceased":1,"living":0}},{"state_code":"AGU","state_name":"Aguascalientes","year":2024,"organ":"kidney","donations":415,"transplants":86,"waitlist_end_of_year":null,"rate_pmp":56.2,"donor_type_breakdown":{"deceased":29,"living":57}},{"state_code":"AGU","state_name":"Aguascalientes","year":2024,"organ":"liver","donations":415,"transplants":2,"waitlist_end_of_year":null,"rate_pmp":1.3,"donor_type_breakdown":{"deceased":2,"living":0}},{"state_code":"AGU","state_name":"Aguascalientes","year":2025,"organ":"cornea","donations":180,"transplants":17,"waitlist_end_of_year":null,"rate_pmp":11.0,"donor_type_breakdown":{"deceased":16,"living":0}},{"state_code":"AGU","state_name":"Aguascalientes","year":2025,"organ":"kidney","donations":180,"transplants":29,"waitlist_end_of_year":null,"rate_pmp":18.7,"donor_type_breakdown":{"deceased":2,"living":27}},{"state_code":"BCN","state_name":"Baja California","year":2020,"organ":"cornea","donations":15,"transplants":26,"waitlist_end_of_year":null,"rate_pmp":6.8,"donor_type_breakdown":{"deceased":5,"living":0}},{"state_code":"BCN","state_name":"Baja California","year":2020,"organ":"kidney","donations":15,"transplants":13,"waitlist_end_of_year":null,"rate_pmp":3.4,"donor_type_breakdown":{"deceased":3,"living":10}},{"state_code":"BCN","state_name":"Baja California","year":2020,"organ":"liver","donations":15,"transplants":2,"waitlist_end_of_year":null,"rate_pmp":0.5,"donor_type_breakdown":{"deceased":2,"living":0}},{"state_code":"BCN","state_name":"Baja California","year":2021,"organ":"cornea","donations":91,"transplants":43,"waitlist_end_of_year":null,"rate_pmp":11.1,"donor_type_breakdown":{"deceased":3,"living":0}},{"state_code":"BCN","state_name":"Baja California","year":2021,"organ":"kidney","donations":91,"transplants":38,"waitlist_end_of_year":null,"rate_pmp":9.8,"donor_type_breakdown":{"deceased":5,"living":33}},{"state_code":"BCN","state_name":"Baja California","year":2021,"organ":"liver","donations":91,"transplants":1,"waitlist_end_of_year":null,"rate_pmp":0.3,"donor_type_breakdown":{"deceased":1,"living":0}},{"state_code":"BCN","state_name":"Baja California","year":2022,"organ":"cornea","donations":90,"transplants":49,"waitlist_end_of_year":null,"rate_pmp":12.4,"donor_type_breakdown":{"deceased":3,"living":0}},{"state_code":"BCN","state_name":"Baja California","year":2022,"organ":"heart","donations":90,"transplants":1,"waitlist_end_of_year":null,"rate_pmp":0.3,"donor_type_breakdown":{"deceased":1,"living":0}},{"state_code":"BCN","state_name":"Baja California","year":2022,"organ":"kidney","donations":90,"transplants":64,"waitlist_end_of_year":null,"rate_pmp":16.2,"donor_type_breakdown":{"deceased":2,"living":62}},{"state_code":"BCN","state_name":"Baja California","year":2023,"organ":"cornea","donations":134,"transplants":29,"waitlist_end_of_year":null,"rate_pmp":7.2,"donor_type_breakdown":{"deceased":7,"living":0}},{"state_code":"BCN","state_name":"Baja California","year":2023,"organ":"kidney","donations":134,"transplants":72,"waitlist_end_of_year":null,"rate_pmp":18.0,"donor_type_breakdown":{"deceased":3,"living":69}},{"state_code":"BCN","state_name":"Baja California","year":2023,"organ":"liver","donations":134,"transplants":2,"waitlist_end_of_year":null,"rate_pmp":0.5,"donor_type_breakdown":{"deceased":1,"living":1}},{"state_code":"BCN","state_name":"Baja California","year":2024,"organ":"cornea","donations":151,"transplants":82,"waitlist_end_of_year":null,"rate_pmp":20.1,"donor_type_breakdown":{"deceased":12,"living":0}},{"state_code":"BCN","state_name":"Baja California","year":2024,"organ":"kidney","donations":151,"transplants":64,"waitlist_end_of_year":null,"rate_pmp":15.7,"donor_type_breakdown":{"deceased":4,"living":60}},{"state_code":"BCN","state_name":"Baja California","year":2024,"organ":"liver","donations":151,"transplants":4,"waitlist_end_of_year":null,"rate_pmp":1.0,"donor_type_breakdown":{"deceased":4,"living":0}},{"state_code":"BCN","state_name":"Baja California","year":2025,"organ":"cornea","donations":79,"transplants":42,"waitlist_end_of_year":null,"rate_pmp":10.2,"donor_type_breakdown":{"deceased":6,"living":0}},{"state_code":"BCN","state_name":"Baja California","year":2025,"organ":"kidney","donations":79,"transplants":40,"waitlist_end_of_year":null,"rate_pmp":9.7,"donor_type_breakdown":{"deceased":2,"living":38}},{"state_code":"BCS","state_name":"Baja California Sur","year":2020,"organ":"cornea","donations":5,"transplants":9,"waitlist_end_of_year":null,"rate_pmp":11.0,"donor_type_breakdown":{"deceased":8,"living":0}},{"state_code":"BCS","state_name":"Baja California Sur","year":2021,"organ":"cornea","donations":8,"transplants":21,"waitlist_end_of_year":null,"rate_pmp":25.2,"donor_type_breakdown":{"deceased":18,"living":0}},{"state_code":"BCS","state_name":"Baja California Sur","year":2021,"organ":"kidney","donations":8,"transplants":1,"waitlist_end_of_year":null,"rate_pmp":1.2,"donor_type_breakdown":{"deceased":0,"living":1}},{"state_code":"BCS","state_name":"Baja California Sur","year":2022,"organ":"cornea","donations":28,"transplants":18,"waitlist_end_of_year":null,"rate_pmp":21.2,"donor_type_breakdown":{"deceased":11,"living":0}},{"state_code":"BCS","state_name":"Baja California Sur","year":2022,"organ":"heart","donations":28,"transplants":1,"waitlist_end_of_year":null,"rate_pmp":1.2,"donor_type_breakdown":{"deceased":1,"living":0}},{"state_code":"BCS","state_name":"Baja California Sur","year":2022,"organ":"kidney","donations":28,"transplants":12,"waitlist_end_of_year":null,"rate_pmp":14.1,"donor_type_breakdown":{"deceased":2,"living":10}},{"state_code":"BCS","state_name":"Baja California Sur","year":2022,"organ":"liver","donations":28,"transplants":2,"waitlist_end_of_year":null,"rate_pmp":2.4,"donor_type_breakdown":{"deceased":2,"living":0}},{"state_code":"BCS","state_name":"Baja California Sur","year":2023,"organ":"cornea","donations":43,"transplants":11,"waitlist_end_of_year":null,"rate_pmp":12.7,"donor_type_breakdown":{"deceased":4,"living":0}},{"state_code":"BCS","state_name":"Baja California Sur","year":2023,"organ":"kidney","donations":43,"transplants":8,"waitlist_end_of_year":null,"rate_pmp":9.2,"donor_type_breakdown":{"deceased":1,"living":7}},{"state_code":"BCS","state_name":"Baja California Sur","year":2023,"organ":"liver","donations":43,"transplants":1,"waitlist_end_of_year":null,"rate_pmp":1.2,"donor_type_breakdown":{"deceased":1,"living":0}},{"state_code":"BCS","state_name":"Baja California Sur","year":2024,"organ":"cornea","donations":53,"transplants":13,"waitlist_end_of_year":null,"rate_pmp":14.7,"donor_type_breakdown":{"deceased":7,"living":0}},{"state_code":"BCS","state_name":"Baja California Sur","year":2024,"organ":"heart","donations":53,"transplants":1,"waitlist_end_of_year":null,"rate_pmp":1.1,"donor_type_breakdown":{"deceased":1,"living":0}},{"state_code":"BCS","state_name":"Baja California Sur","year":2024,"organ":"kidney","donations":53,"transplants":5,"waitlist_end_of_year":null,"rate_pmp":5.6,"donor_type_breakdown":{"deceased":2,"living":3}},{"state_code":"BCS","state_name":"Baja California Sur","year":2025,"organ":"cornea","donations":21,"transplants":6,"waitlist_end_of_year":null,"rate_pmp":6.6,"donor_type_breakdown":{"deceased":1,"living":0}},{"state_code":"BCS","state_name":"Baja California Sur","year":2025,"organ":"kidney